date,rating,userName,title,review
2025-09-20 08:10:15-07:00,1,jzy612,Bad service,At first it was all good and when i try to subscribe again i pick the cheapest one it didn’t give me anything i cant do nothing until i go pro it forced me to pay more! Not worth it I’m deleting this app! It’s a trickster made me pay for nothing!
2025-09-19 18:36:43-07:00,5,Crea tus videos,La mejor,Me encanta recomendada para editar tus fotos
2025-09-18 17:40:54-07:00,3,𝕓𝕣𝕒𝕟𝕕𝕚,Very glitchy,Slow and glitchy. Frustrated to use
2025-09-08 08:04:35-07:00,1,Mattysclerosis,Scam,Said of you paid for the pro version you get 12 free image to video per day and any addition cost 6 credits.  I paid the $80 and received none of those things. I got 40 credits and the image to video charged 30. So basically I laid $80 for one pic
2025-09-08 07:04:12-07:00,1,BREasy518,Took payment before trial was over,I downloaded and looked at the app said a 7dat trial. Did not use. 79.99 was immediately removed from my account and I have yet to receive a refund.
2025-09-07 04:30:12-07:00,1,Uffdaboy,Was great when it worked,"This was a fantastic app, so much so AI purchased the VIP plan for a year and know most of the features have suddenly stopped working"
2025-09-06 14:52:35-07:00,1,NashandTobey26,Awful!!!!!,They are thieves! The app is slow and doesn’t work. They trick you into buying things. Do NOT recommend
2025-09-04 18:09:24-07:00,1,eglantinelucy,SCAM ALERT!,Canceled the same day I signed up for free trial and was still charged! Apple denied my refund!
2025-09-04 16:10:00-07:00,1,asdffgghhjjkkjfzc,Bad quality overall,This AI app is not good quality and really makes you look like a clown. Don’t waste your time just choose another app to use.
2025-09-03 06:45:58-07:00,1,25Unhappy,Dishonest,I signed up for a 7 day free trial of the app to see if it would do what I needed.  I have been charged $80 for an app that does not do what I needed and that was supposed to be a free trial.  I have given 1 star because there is not an option for 0 stars.
2025-09-02 18:38:29-07:00,2,Asdfjklsdfbvcsew,Latest update,Kind of upset that I have the upgraded version of this app that I paid for and now on the latest update no longer lets you use it for “whitening teeth” sends you to the makeup app and you have to pay again to get a second upgrade in order to use teeth whitening function .
2025-08-31 22:21:19-07:00,1,Ebsnyy,Scam,They make it so hard to find the “delete my account” section the “FAQ” is false information and I don’t trust this app AT ALL . I think they are a scam
2025-08-31 09:48:01-07:00,1,Dragon223,No way to cancel 24 hour trial,20 hours ago I signed up for a 24 hour trial of YouCam Perfect Pro. I found the AI object remover was not able to handle the task I needed done. Now I find I can find no way to cancel and get my $79.99 back. It’s clearly a powerful tool but not one I need to
2025-08-29 13:50:49-07:00,1,KristinaHikes,Fraudulent Charges,Canceled subscription and they refuse to refund me. 0 support from app.
2025-08-22 12:32:45-07:00,1,Toplum Polisi,Free trial is a scam do not install the app,FREE TRIAL IS A SCAM DO NOT INSTALL THE APP UNLESS YOU HAVE A LOT MONEY TO TRASH
2025-08-21 21:30:27-07:00,5,karmabesos,Perfect for people that just want to soften without looking fake!,As an ex model I love this app as you can pre set the amount you want to beautify as you take the photo. I don’t want a totally photoshopped image I like to keep as natural as possible but love the way I can just tweak it slightly to blur out the shine or shadows. To be honest I don’t use all the features but if you are after a little soft focus without the fake look this is the app for you!
2025-08-15 09:05:04-07:00,1,Cxr99,Free trial is a scam!,I downloaded the app because of the free trial. I had just came back from vacation and remembered to cancel trial however that morning I noticed I had already been charged $80!  I never intended to purchase this subscription & Apple won’t even give me a refund! This is ridiculous!!
2025-08-13 18:36:47-07:00,1,Hate this app!$!,Free trial is a scam!!!,Cancelled on 7th day but still got charged $85!!! Not worth the features by a long shot
2025-08-12 16:24:10-07:00,1,ikkhgujjhj,horrible app,"this app is absolutely horrible doesn’t work and it just not necessary it gives fake and ugly not natural
and cute ."
2025-08-10 09:22:09-07:00,1,DaeguDave,BEWARE DO NOT DOWNLOAD THIS APP!,"I guess I downloaded this program all though I don’t remember using it ever. 
Yesterday I was charged $79.99 for a year renewal. 
I received no notice that they would be charging me for b this or I would have cancelled it way before. 
I went through Apple to get a refund one day after I was charged and they refuse to refund. 
BEWARE DO NOT DOWNLOAD THIS APP!"
2025-08-07 15:22:11-07:00,5,KatrinaG2816,County Fair 1965,A much beloved childhood a
2025-08-05 21:59:21-07:00,1,Runner81a,Not free,"Works good, limited collage options only lets you use once before having to pay for the app"
2025-08-05 12:21:48-07:00,5,Horrible messenger,This is Awesome!,This is the best app for perfecting already taken photographs to taking new selfies! I just started fooling around with it but it’s really cool.
2025-08-03 09:36:27-07:00,1,LonnyBreaux,App use to be good,The app use to be good now they’re just money hungry making me upgrade when I already pay a monthly membership. Scammers
2025-08-02 20:48:28-07:00,5,bibi05$,It became a free app that you have to pay for everything,Now for any photo change it is paid!
2025-08-01 14:01:02-07:00,1,Summerbussey,Took away my LIFETIME membership,Don’t buy anything on this app. They will take it away at anytime. Paid over $106 for a lifetime membership a little over a year ago and suddenly I do not have access to my lifetime membership for pro features. It is now telling me that I need to buy coins and I have a limit of three free uses of tools a day. Why would I have paid over $100 for only a year of use? Totally ripped me off. Hoping to get a refund. But we will see about this since this was over a year ago I purchased and trusted it would be lifetime. If I don’t receive a refund or membership restore (which I do not see lifetime as an option to purchase anymore)  they definitely lost someone who actually liked this app enough to purchase the lifetime membership. I will not be recommending this to anyone anymore otherwise. Will update this review
2025-07-31 18:11:25-07:00,1,Myles keys,Worst game,This game is a big waste of time don’t download this stupid cringe game.   This is so stupid.  Make a better game.
2025-07-30 18:05:22-07:00,1,IE@cookies,This app is horrible,You need a subscription for everything
2025-07-30 17:45:35-07:00,5,Natopoly,Love this app!,This app is amazing. Definitely recommend it!
2025-07-29 21:42:36-07:00,2,Shayshi328,Great app until the subscription price increase.,"Will not be using anymore. I had the 10$ monthly subscription for 6 months. It worked perfect for me. It wasn’t the “pro” plan, but I was able to use most of the editing tools. Until one day they increased the price by like 50% without warning. Which didn’t charge me, however all of the editing tools I had been using in my current subscription the last 6 months I suddenly weren’t able to use anymore. And now were part of the “pro” plan. If I would have known that I wouldn’t have paid for that months subscription. Because the specific AI editing tools that the “pro” plan only offers now, I had been using for months, for half the price."
2025-07-28 20:09:10-07:00,1,Jaysi816,Trial scam,"This app is set up to where it shows like you’re getting a free trial, but if you don’t click a small option you’re actually bypassing the trial and paying for it immediately."
2025-07-23 22:12:14-07:00,5,OneMedspa Amy,The best,The best out of all the photoshop app. Includes tons of styles and options
2025-07-23 20:22:25-07:00,1,Princesa_Baca,Scam app,"Gives you the option of a “free” 7 day trial before starting a subscription, when I agreed to the 7 day trial, I was immediately charged without consent for a full year subscription up front at the cost of 79.99 plus tax! I immediately cancelled it and sent Apple a refund request and deleted this deceptive app!! Would NOT recommend"
2025-07-22 20:15:43-07:00,1,Hm8883828,Charged me wrongly,I wanted to try the trial version after that monthly but then they charged for the whole year I never use for whole year which was $85.29. And the apply rejected for a refund.
2025-07-18 15:53:34-07:00,1,Erika2591,Free trial is a scam,Don’t do the free trial. I was on vacation when I activated it and forgot to cancel immediately. I went to cancel the 7 day free trial on what should have been the last day of it and they had already charged my card $84. I am livid. This was a purchase I never intended to make and Apple said it is not eligible for a refund. This app is not even worth as much as they are charging. I can’t even type all of the words I have to express how angry I am over this because they probably won’t publish my review.
2025-07-17 18:51:02-07:00,1,Anna Nalepka,They charged me one day earlier than the renewal date!,I started a seven day free trial on this app on 7/11/2025 it was due to be charged my credit card on 7/18/2025 today is7/17//2025 and as I picked up my phone to cancel the subscription so I WOULD NOT be charged I get a notification that my card was charged anyway! On 7/17/2025 !! they charged me on the 6th day!!! Want a FULL REFUND  of $79.99 ISSUED TO MY CARD IMMEDIATELY!!!
2025-07-16 13:22:29-07:00,1,WatSi323,They stole my money after a free trial,"Don’t try their free trial. There’s not much to do in this app and if you forget to cancel before the end of the trial, they will charge a whole year. This app is useless almost $80 for something that didn’t work. Now they keep saying that they can’t cancel this or refund my money even though I don’t use it."
2025-07-15 19:48:55-07:00,1,Idek fr bruh,Worst app ever,Don’t download this you can’t use anything without 9 dollar a month premium 💀💀
2025-07-12 04:51:36-07:00,1,Lindsey Elmore,Does a poor job,Will not remove shadowing
2025-07-09 11:06:33-07:00,1,student #10947,👎,can’t do anything without paying
2025-07-08 21:19:46-07:00,5,glee.009,Love ir,Good
2025-07-08 15:46:45-07:00,5,Kimbery0077,YouCam Perfect: Beauty Camera,This app is the best so far in all editing platforms. I love it. It deserves more than 5 stars.⭐️⭐️⭐️⭐️⭐️⭐️⭐️⭐️⭐️⭐️
2025-07-07 08:29:35-07:00,1,yall a scam,downgraded every year,Ive had this app since i was young. It used to have options for free and now they are all under a pay wall they also made it so you cant screenshot uour picture in app without paying. Its basically unusable unless you pay 80 bucks which is crazy for an app that basically does nothing compared to better photo editing software
2025-07-07 07:53:32-07:00,1,Lsncbdvhdvahd dbcn,Diz que é de graça mas bloqueia qualquer print de tela,Tentei dar print e o app bloqueia a foto. Não dá pra saber se o app é bom ou não! Não recomendo
2025-07-06 07:52:43-07:00,5,RegP,Great App,This app is great! Use this ISS great app if your cell phone camera malfunctions. Improve photos in 2 minutes for free!
2025-07-03 14:09:08-07:00,1,Jones454,Scammed and out of money,"Don’t do it ! The free trial is scam , and Apple will not give you a refund. It says a free trial but they charge you immediately and now Im out of 80$."
2025-07-02 05:45:33-07:00,2,Dc946,Not what I needed,"While the app had lots of options, it wasn’t quite what I needed and not as user friendly. I tried to cancel the trial but was still charged. Apple support has been unable to help and I can’t contact the developer. I now have an expensive app that doesn’t fit my needs."
2025-06-30 22:19:12-07:00,1,Lovebug1195,Scam,"They offer you a free trial & when you accept or purchase it, it charges you the $74.99 price and then you’ll see at the very bottom after you purchase it ever so tiny a button to turn ON the free trial to accept it. But then you’ve already paid. I’d love a refund if you guys have any morals. Horrible."
2025-06-30 16:20:00-07:00,1,uptownpower,SCAM!,"Was charged the monthly membership price of $13 IMMEDIATELY, although it clearly STATED I was given a 7-day free trial and a date of 7/7/25 as beginning of membership and only if I decided so! 
MISINFORMATION = SCAM
Issue the refund NOW or I’ll take it to my finance lawyer."
2025-06-27 10:35:50-07:00,1,AngelR1015,Purposely Lowers Quality,"The photos on my phone are clear but once I upload them to this app it purposely lowers the quality so you have to buy their subscription to get a higher quality photo. Total deception. Do not waste your money on this app, that’s what they want is your money so be careful because they’ll purposely make your photo low quality when you upload it so you pay to make it look “better”."
2025-06-27 09:00:16-07:00,1,mcullough1997,Maliciously charged me for pro and won’t give refund,Terrible product. Horrible editing and severely affects image quality
2025-06-26 21:01:00-07:00,1,Cassandra Schrock,Immediately goes to a pay wall,"Can’t really try this out without a credit card, uninstalling"
2025-06-20 19:13:08-07:00,1,aphghqrs,Please cancel,I have tried several times to cancel and you refuse to cancel . You keep trying to charge my card illegally. Therefore I can’t add a card to my phone because of you thieves. You won’t answer. Do not get this free trial. Fraudsters!!
2025-06-20 18:46:40-07:00,5,Vanessa Trans,Beautifully Girly,Makes Me Feel So Girly
2025-06-18 22:34:41-07:00,1,Leo Forever,Deceived. I signed up for the FREE version but got charged the full amount a few hours later.  Fraud,"On June 16, 2025, I signed up for the FREE/ trial version BUT to my surprise and dismay, only a few hours later I was  billed for an annual subscription - $79.99 - ABSOLUTELY CRAZY. I signed up for the FREE / Trial version. They are supposed to automatically charge your credit card if you don’t cancel the  annual subscription before the end of the trial. I didn’t even have time to see if I like the app. I was billed hours after my trial started. That’s fraud. They stole from me. This charge was not authorized. You can see both the Free and the yearly plan were done on the same day. I’m not sure why Apple declined this, but I read on the forum that this has happened time and time again with apps. I don’t know if Apple is in cahoots with some of these app developers, but please be careful. It’s extra work but you’ll  have to go to your credit card company and dispute it there but Apple should be taken care of these. This is crazy.. Who can you trust? The options are getting smaller"
2025-06-17 14:38:13-07:00,1,DawgPatch Shiner,Scammers,The app developers are thieves. I subscribed for a free 1 week trial and instead they charged me 79.99 for an annual subscription the same day I subscribed for the free trial.  I requested a refund since I did not subscribe for an annual subscription and they denied it. Do not subscribe for a free trial because they steal your money.
2025-06-12 18:15:54-07:00,1,dont ever install ts,nahuh,HORRRIBLEE APP ISTG DO NOT INSTALL THIS BSSS ISTG EVERYTHING ID PREMIUM AND TJEY LIE JUST TO MAKE U HAVE TO PAY ST THE END NAH YH
2025-06-11 10:01:32-07:00,1,BriSlayer,Do not use!!!,I signed up for the free trial and it immediately charged me $80. Do not use this app!
2025-06-10 16:43:38-07:00,1,TrueLo7,Can do nothing,"No savings of my work, white screen, no more opportunities and just nothing"
2025-06-08 18:29:59-07:00,1,LKRC35,Scam,This is a complete scam. Now they limit the number of times you can use certain features even when you pay for a subscription!! Absolutely ridiculous. I want my money back.
2025-06-07 21:25:29-07:00,1,Jessicaaaaa ✌️,Search free,Requires “free trial”
2025-06-06 21:25:41-07:00,5,luna secreta,Me encata esta. Aplicación. Es genial.,Super.  Excelente.Tiene.  Lo que no tiene otras aplicaciones. Me encanta. Por eso le doy 5 estrellas
2025-06-02 19:36:51-07:00,5,XxXWildflowerXxX,Ten stars,I’d give this app ten stars if I could. Certainly worth every penny!
2025-05-31 10:26:32-07:00,1,aravioliii,Deceptive layout—“Free trial” does not exist,"This app straight-up tricked me. The screen looked like I was starting a 7-day free trial, but the second I confirmed, it charged me $79.99 for a full year—no warning, no clear notice. And no, I didn’t forget to cancel after a trial period. I was immediately charged within seconds and I canceled immediately and never used the app beyond that point. I followed that up with a refund request to Apple within 5 minutes of the incident. 

Apple denied my refund, even though I’ve never abused refunds and they’ve helped in way more minor situations. Now I’m stuck either eating an $80 loss for an app I’ve never used nor got the chance to even enjoy. This is making me rethink using Apple at all. If this is the kind of shady app they allow (and protect), that’s a huge red flag."
2025-05-30 20:03:32-07:00,4,Skadoe,You cam perfect,"I’ve only had a chance to edit two photos but so far so good.
 I like that There are a lot of options to change/add to your photos. 
I’m excited to try them all out!"
2025-05-26 07:48:26-07:00,3,Kit19Kat,Lots of fantastic features - on my short list of BEST,"Please be clearer about “free 7 day trial”.  I clicked on it but there was no free trial.  Each effect or tool brings you to a payment screen.  
The features are awesome, but a lot of us don’t have 80+ bucks to spend on an editing tool.  I realize you have to keep up with the trend to stay afloat.  I bet you’d get even more clients offering $19.99 annually (special offer).
You’re on my of the best list for photo editing tools.  Between you and Photoleap by light tricks.  I’m old school,  can clean & sharpen photos the old way.  However, the instant gratification offered is hard to deny!"
2025-05-25 08:37:37-07:00,1,tartaruspack,Terrible service and theft,"For those of us whom this developer stole money from by saying it was a “free trial” and immediately charging you $85…REPORT AS FRAUD TO APPLE. 

Go down the page to information and select “Report an issue,” and there is an option to report as fraud there."
2025-05-24 18:20:43-07:00,5,CheyJK765,I love this app!!!!,So good I would change the stuff that isn’t free
2025-05-19 00:30:39-07:00,5,G shine 1983,Perfect,"I recommend this app for anyone who loved to Photoshop. This app has great features. I wish I can get this app 10 stars this app will allow you to try to features, but you won’t be able to save them which is wonderful."
2025-05-16 20:10:53-07:00,1,hjh bh,TERRIBLE APP!😡😡😡😡,Don’t download this booty of a app u literally . I was just trying make forehead pay for it ! Absolutely not!😡
2025-05-15 10:24:11-07:00,1,Scabbage2012,Wish I could give no stars,I tried to use the face swap feature and it wouldn’t even let me export it. All of the good features require pay and they don’t even let you export. This app is run by a bunch of cheapskates.
2025-05-15 09:04:04-07:00,5,Lucy Loxley,Absolutely great,I just tried it for first time on moms phone and will download when I am home
2025-05-14 11:42:31-07:00,1,Dria284,Disappointed,After paying so much money for a pro subscription for a month. I'm still not able to use the al features...this is crazy. There nothing on the app that is working. $16 a month and nothing works
2025-05-13 14:54:45-07:00,1,Jaik from statefarm,Forced subscription,Not worth downloading they’ll let you edit your photo then block access to it with forced subscriptions.
2025-05-13 09:28:34-07:00,1,madsnickety,BEWARE OF THIS APP!! Free trial not as advertised,"Was advertised a free trial, and was charged $80 immediately to my card. Contacted Apple for a refund and was denied. Not even an explanation of why. Called support and was told no one there could change that decision. So don’t get ripped off by this app like I did."
2025-05-10 17:54:29-07:00,2,mrs.wright17,Would be cool if it was free,Can’t do much without paying
2025-05-01 20:01:25-07:00,5,Riimabooskiiz,⭐️⭐️⭐️⭐️⭐️,⭐️⭐️⭐️⭐️⭐️
2025-04-29 18:36:27-07:00,5,RAYROD888,Phenomenal App,Excellent editor I’ve been using this app for years it’s always my go to editing app 🫶🏻
2025-04-29 12:10:36-07:00,5,3r1e,Love!! Love!! This app!!,Makes my mediocre photos look professional!
2025-04-29 11:58:17-07:00,1,https.green_7,Terrible app,Money hungry app
2025-04-28 13:52:45-07:00,5,valeriyaidlbi,super,hot like nuclear power
2025-04-28 07:28:07-07:00,3,X10002,Was good until recent,"I used to love this app for the Ai replace feature, the editing tool was really helpful for getting rid of very specific blemishes in photos. I know there's other tools available but they didn't work nearly as well as the Ai replace. However, as of the past month or so it seems they've become a lot more ""strict"" on what is ""appropriate"" and not. It could be a pic of my face and the prompt could be ""remove this wrinkle"" and it'll say it was suggestive content and won't do it. Quite saddened by this abruptly change. I pay the $20 a month for it but as of late, doesn't seem worth it anymore. Other than that it's an okay app."
2025-04-26 10:32:45-07:00,1,Dottie1215,I thought this was a free app,You can’t do anything unless you pay for a subscription. Is anything free anymore?
2025-04-23 06:14:35-07:00,5,Bri David,I,"I love it…
Has good amazing features and easy to use as long as you’re familiar with simple editing"
2025-04-23 04:20:16-07:00,2,Smith10041982,Expected more from service I’m paying for,You pay for the service but it restricts what you are allowed to ask AI to replace. Photos also look touched up after using the tools.
2025-04-21 23:24:57-07:00,3,vincent le ray,Prefer the older version,"I miss the old “remove” feature, this new “A.I remove” is honestly horrible please bring back the old version as an option, It was the main reason why I paid for premium."
2025-04-20 11:48:19-07:00,1,Jxksoabsoslbddjxldnxb,Why I don’t like YouCam Perfect,I have to pay to remove people from my pictures which is unacceptable.
2025-04-11 16:03:27-07:00,5,23nofear,Good,Excelente
2025-04-07 11:01:11-07:00,2,astayathimemomdoingherething,Ai replacement,It doesn’t listen to directions well airbrush app is much more efficient
2025-04-04 11:14:53-07:00,1,toexpensiveee,Don’t sign up for free trial!,I signed up for a free trial back in 2024 and never ended up using the app! I cancelled and got charged $40 and asked for a refund from Apple. Apple denied my request ok I sucked it up and let it go. But then a whole year later got charged again for a renewal after I previously cancelled! I don’t want this app it’s useless and they will keep charging you whether you want it or not! Beware!
2025-04-03 05:53:19-07:00,1,𝕂𝕚𝕒ℙ𝕒𝕨𝕤𝕆𝕟𝕊𝕥𝕠𝕣𝕖③⑦④,I hate this app because it’s trying to be better than YouCam fun,Stupid
2025-03-31 09:36:32-07:00,2,Meesa33,Price,"I used to use this app all the time, but now all of a sudden you need a subscription to use most of the features that were previously free. It's very upsetting."
2025-03-25 13:00:50-07:00,4,milan_reviews,NICE JOB!,pretty good!
2025-03-22 23:02:50-07:00,4,NMarin2,A Lot of Options With Purchase,There’s a lot of options but you have to purchase this app. The free options are so few and very limited. My advice before purchasing try the different effects and get used to it. You won’t be able to save the photos unless you purchase it but at least by trying it you’ll get an idea of how it works.  Then you can make an informed decision about buying it.
2025-03-22 10:53:18-07:00,5,Ksj4fsu,Easy to Edit any Photo,Have been really happy with this app. Beginner user friendly. Have been happy with photo outcomes.
2025-03-21 04:28:35-07:00,1,"No good, waste of money",Do not get this app,I chose the weekly billing in the event i wanted to continue after the free trial. They still billed me 79 for a year instead.  Retake is a much better app
2025-03-20 15:04:29-07:00,1,Lllllllooppsdjdbehe,Scam,Do not use this app even for the free trial!! They charged me $84 for a year subscription and I used the app once!!! Apple refused my request for a refund and the company said they cannot help me. So I just handed them over $84. NOT RIGHT!!!
2025-03-19 11:46:17-07:00,1,Claire Elise C,waste of time,you need to pay for everything.
2025-03-19 09:39:32-07:00,1,Midnitefun27,This app is scam,"Don't ever download this app unless u wanna pay $79.00 even tho I already cancelled.. and those support at Apple wont help u by denied your request  many ppl  specially teens are being scam as well ., just read the review  thus teen  disappointed how cruel this company doing as such a biz.. I think it's Apple product  working together any other apps once  your free trial is up  that's it unless u called them and tell u interested to fir subscription but not thus one u cancelled they are going to still charge u  and how is that alright fir this apps to Robert and other apps can't tell me that anyway this not the end  I will take this court the apps  and Apple as well .. u guys think u won will see .."
2025-03-14 07:01:45-07:00,5,Val🤍VILL,Refund help for yearly subcription,I was charged for a yearly subcription but I’m can’t afford pay $83. This was an accidental charge would the app developer be willing to offer me a courtesy refund ? It will really help me. Please
