date,rating,userName,title,review
2025-03-13 14:50:49-07:00,5,Pretty littlepatriot,Great app,"This app is the best and has more than just every filter that you can imagine, it has video filters and more. I was really shocked with this app."
2025-03-12 09:33:07-07:00,5,No puedo con tanto,Me encanta,Muy buena la aplicación tiene variedad de opciones
2025-03-10 13:50:33-07:00,1,Kazmas111,Everything looks horribly fake,Any AI features are literally horrendous… doesn’t do what it claims to do. Worst app ever unless you wanna look ridiculously fake.
2025-03-07 17:17:11-07:00,5,Christine ying,Best photo filter editor!,Love it and I tried so many apps but it’s my favorite
2025-03-06 20:11:23-07:00,5,Full of life💕,Love it!,I love this app!!  Beautiful pics!!
2025-03-03 06:24:14-07:00,1,Ecam1975,Not a good app for the value,Every feature that will drastically change your picture has extra costs. I don’t recommend this app.
2025-02-28 14:14:39-07:00,1,Yall should do better,Do better,"I hate this app because if you try to do anything you have to pay money and you can’t rlly do anything without paying so this app is terrible 

DONT GET IT"
2025-02-25 16:07:26-07:00,5,kulambog,Best photo apps,Best apps to remove unwanted people or things in your background
2025-02-24 14:18:28-07:00,1,Inali2006,Bummer,"This app used to be my “go-to” for doing a quick edit if I didn’t like the way the light captured my face or I didn’t smile big enough or the occasional blemish remover, but now all those things are not available unless you pay.

I understand that’s the price of business, but I have to let it go."
2025-02-23 16:11:08-07:00,1,Thetruthbehindapps,This app is terrible does not even deserve one star,This app does not let you do anything without paying. If you do pay it is 100% not worth it. It does not work well and instead of doing as it is supposed to just warps your body. The hair changer does not work and the acne eraser makes your acne look HUGE. I would never recommend this app and would recommend snapseed that’ works so much better and is 100% free. I am just your average girl trying to look good in photos but this app really lowered my self esteem.
2025-02-23 07:13:41-07:00,1,Nicehoymañana,Mala,Hay foto que me dice que no puede editar y no entiendo el motivo
2025-02-22 02:12:22-07:00,5,Fonz Coinmaster Dollas,I’m Loving This App!!!,"It has so many Great Features and things you can do with it, I’ve literally been having fun all day with YouCam editing amazing quality pictures"
2025-02-21 20:27:51-07:00,4,Velociraptor802,Addicted,Addicted
2025-02-21 14:52:00-07:00,1,Edawnable,Watch out for this,Charge me for the whole year without sending me a notification renewal on my phone or email before canceling on the day trial has ended. Ridiculous.
2025-02-20 15:00:36-07:00,5,Dog Madelyn,Please read🥹,"This is fun and all.But The reason I got this game is to make is to make my photos of feather but most of the things or a crown which is most of the good ones cause money and I don’t like spending money for games so if you like spend money for games, I would do that, but if you don’t don’t get this game unless you only want that OK ones"
2025-02-19 18:17:27-07:00,1,Zignatius,Doesn’t work well,Glasses removal and face swap don’t work. Spent way too much time and it either didn’t work or looked ridiculous
2025-02-12 00:39:38-07:00,3,Jjtee%,Shade remover,"The face shade remover you advertised was not easily accessible for me. What I did eventually find yielded horrible results, nothing like your promo."
2025-02-11 20:28:39-07:00,1,Hekdhnwnsk,$50 MORE?!,I’ve been battling with this app and the Apple Store for weeks over this I currently have a premium subscription on my android that I have had for years paying $28.99/year on this new apple phone it’s now trying to charge me $79.99/year. The app is signed into my account and shows it’s me but wants me to pay $50 more?! Makes no sense and both Apple Store and this app says it’s the other guy they can’t do anything….loyal customer for at least 3 years and they can’t do anything to help me?!
2025-02-10 23:08:08-07:00,1,Piimpdaddybry,Zero stars,This used to be my favorite app until they started charging for every single thing… I have to pay to remove blemishes now … really.? No thanks.
2025-02-10 10:46:07-07:00,1,Whydidyoutakethataway,Nose feature and lip shape size feature is missing.,This app asked me to update it and I did only to be massive disappointed. Nose feature and lip shape size feature is missing. Why is that?
2025-02-07 12:25:17-07:00,5,Wut Yi Win,Verrry nice Camera,Happy to our mind
2025-02-07 09:00:42-07:00,1,Niko7313,Scam,"It runs on the point system, even if you pay for it. You still have to pay for points to use the app, it is a scam."
2025-02-05 21:53:32-07:00,5,I’m just gonna be honest there,I’m just gonna be honest there,All the names in the book
2025-02-05 18:45:20-07:00,1,Tessita86,SCAM,Horrible app- I tried one photo and it made my bf look like some weird pirate. The next day I saw a charge for a YEAR SUBSCRIPTION. I NEVER signed up for this and they charged me for a year. Absolute joke
2025-02-04 04:25:11-07:00,1,آبن قويد,بفلوس,كل الميزات المعروفه بفلوس
2025-02-02 19:22:01-07:00,4,Vivifairy678,Pretty good,I really like it. The only thing is I don’t really like how you only get three things to do before you have to like buy something but overall it’s pretty good
2025-02-02 11:13:05-07:00,1,rizzo5586,Don’t waste your time or money.,"Incredibly non intuitive. When asked to remove glare from my glasses, it replaced my entire face with an ai generated person of another race. Is that worth $80/year to you? 

Pathetic"
2025-02-01 09:50:45-07:00,1,Sebas&&$,Publicida engañosa,Públicidad engañosa los voy a demandar por publicidad engañosa y si me hicieron pagar mucho dinero es muy mala no hace lo que uno elige muy mal
2025-01-31 08:52:52-07:00,1,Chuckerman,Careful! No Refund $79,"“UPDATE 01/31/25”: Publisher contacted me about my original review. Offered no solution aside from what I have already tried. Publisher told me to request a refund which I have done on two occasions and both times was declined.

Original Review: ""I was unknowingly enrolled in a $79 annual membership following an unauthorized purchase made by a family member. I discovered this during a routine bank account review. Upon contacting the publisher, I was unfortunately denied a refund. This leaves me with an app I have no use for. Due to their inflexible refund policy, I will not consider this publisher for any future subscriptions."""
2025-01-27 10:04:33-07:00,5,For filtros,La mejor aplicación para filtrar,Por eso le doy 5 estrellas
2025-01-26 09:34:23-07:00,5,Sweet little Addie,Sweet Addie,Love-love this app!!
2025-01-17 07:55:30-07:00,5,Party Rental Steve,Nice and easy to use!,Love this App. Easy to use for this old guy.
2025-01-15 18:38:49-07:00,5,Easy listener 100,So far so good,"I like it, easy to use"
2025-01-13 20:04:50-07:00,5,Gabipinto10,Muy bueno,Fantastico
2025-01-13 10:51:35-07:00,5,Fred The Cable Guy,Photo editing,"This website is excellent! Very user friendly and the changes begin with subtle editing so it doesn’t look extreme, but if you’d like stronger editing they do a great job with the whole range. Highly recommend."
2025-01-12 13:06:55-07:00,1,Grampgrans,Not free,"Really frustrating to download a free app only to find out it is not a free app, but subscription required"
2025-01-12 04:54:43-07:00,1,PMA Turkiye,Makes you look like a different person,"I bought this app to try open my eyes in photos where my eyes were shut. The app changes the whole face - not just the eyes, and it looks totally artificial. Unusable photos. Don’t waste your time and money on this app."
2025-01-11 15:24:05-07:00,1,Corruptedwaffles,Ai garbage,I used to really love this app. I had it on my Samsung and I just recently redownloaded it here. Really scummy how you refuse to let anyone opt out of your AI data scraping for photos. I will be deleting this app. Incredibly disappointed in this garbage.
2025-01-10 18:23:51-07:00,5,wineenthusiast,Easy to use!,"When the app showed remove something in a photo, it really let me remove it!"
2025-01-10 07:45:04-07:00,5,PHOTOlink,Excellent app- 99% PERFECT !,One issue is I can’t find where to turn off snap to grid. I wish it was easier to find
2025-01-08 17:38:16-07:00,3,Yogibud1111,Bug fix,"I have had a good experience with this app, but just recently the text border option isn’t working… I can no longer add text blurbs. The color option persists when I try to add a blurb for dialogue or thought. Please fix this."
2024-12-31 16:31:32-07:00,5,Guzy jewelry,Excelente aplicación,"Me encanta esta aplicación, es súper fácil de usar y edita las fotos de una manera espectacular."
2024-12-27 07:13:15-07:00,1,Angrywithfreegimmicks,Hard to cancel,Did 7 day free trial. Wanted to cancel first day & almost impossible to find out how to cancel. Should have an easy link to cancel. Just be warned
2024-12-26 10:29:14-07:00,5,varadero beach,Espectacular,Me gusta mucho es lo q andaba buscando
2024-12-25 23:45:31-07:00,5,Dmb0123,Buen trabajo,Perfecta edición de fotos y videos
2024-12-25 05:59:08-07:00,2,ZeldaF,Very limiting collage features,This app was a disappointment due to the limited options for collages.
2024-12-25 05:20:02-07:00,1,adkmommy,Use A Different App,"I used to love this app, but now every single feature that’s worth using is a premium feature and you have to pay for it."
2024-12-24 04:00:51-07:00,5,jinou lover,J’aime bien,C’est très simple parfait pour moi
2024-12-23 01:41:00-07:00,5,jdndhev,Most Intuitive AI editor,AI features are very easy to use and more realistic than others that I’ve used
2024-12-22 17:02:04-07:00,1,Sethford13,Fraud company,Never put your card information they will take your founds
2024-12-21 07:42:55-07:00,1,UB1,Parents beware,"Lots of unsuitable content for children under 16.  The developers say they need us to tell them where the problem is. There is no way that is true.  They know, they just don’t care. Apple should make this 18+."
2024-12-20 22:36:27-07:00,1,Not free after trial,Not free,This app came up in a search for free photo filter apps. It’s $80 a year!!! No thank you.
2024-12-20 20:45:30-07:00,5,KPYuki,Review,I’m so satisfied to take photos and videos
2024-12-14 19:40:21-07:00,1,Ccccccccb,Total rip off for $39.99,"This app is fine for free but I did a free trial to try some collages & to make a few personalizations for Christmas presents & it was horrible. Simple designs took hours. I’m talking 4 hours for a picture of a dog, a poem & some paw prints. Horrible. The collages would not print without margins & all the pictures came out super light. To top it off, I thought my free trial ending 12/8 meant I could cancel on 12/9 but was wrong & was charged $39.99 which is a complete rip off. Especially since most of the options are “vip.” You charged me $39.99 for an app that can’t even spell yearly right & have the nerve to have a plan that costs more than that?? Of course Apple will not refund because that’s what Apple does so I’ll file a complaint with the FTC for this & all the charges they refuse to refund for my minor children over the years & hope that there will be another lawsuit against them some day. There is nothing about this app that is worth $39.99 & if you want to try it, be mindful of the date the free trial ends because you will be charged."
2024-12-14 00:19:13-07:00,1,xjcjndndnsnckskd,The Eraser Feature,This is a bit explanatory I used this app just for the erasing feature ( 1st according to google on erasing people ) so I installed it and erased the person the I found a glitch like this taking over the person I thought an A.I will show as if no one is there in the background but no a glitch did.
2024-12-13 13:39:38-07:00,5,mary la loca,Mary la loca 😂,Súper lindas quedan las fotos me encantan
2024-12-13 04:58:18-07:00,5,konamoni,use camera,nice
2024-12-12 18:35:49-07:00,5,flyAPP41*,Never disappoints,That is all
2024-12-11 08:12:46-07:00,2,Saku Doll,Terrible,"This app lacks the most basic features, no long straight hair without bangs, no platinum blonde hair colors, and more. I only use the beauty features so I can’t comment on the rest, but the beauty features, especially when it comes to hair needs work.
Update: the developer response makes no sense. I have the yearly subscription and it lacks the basic features I mentioned."
2024-12-10 04:44:46-07:00,5,CMWhite24,Great photo editing app,I can do anything I’ve ever need with this app
2024-12-08 12:08:09-07:00,5,Nikytayayi,Súper,"Fácil de usar , muy divertída , la app premium debe funcionar mejor"
2024-11-30 07:09:17-07:00,1,Mostafa.pmc12,این برنامه پولی یه و اصلا رایگان نیست,این برنامه پولی یه و اصلا رایگان نیست
2024-11-29 18:06:00-07:00,1,staticssound,DONT DO IT!!!!,This app is absolutely terrible. Please don’t spend your money on it especially if you are looking to use the face swap feature. Also app developer people please don’t waste time replying to my review unless you have  completely fixed the issues with the app  that you charge people to use.
2024-11-29 15:30:42-07:00,5,Axelyiker,Me gusta mucho esta cámara,Gracias Adan
2024-11-25 11:35:59-07:00,1,Gaysha Harris,Very upset,I’m not pleased with this app.  I tried to cancel this the first day I downloaded it.  But they have the cancellation set for next year and will not refund me
2024-11-20 22:39:58-07:00,5,Dc669,Best,Best app for all your editing works. Feels so safe and amazing also simple to use.
2024-11-20 15:44:47-07:00,1,Topher is tall,Absolute garbage,"If you’re looking to waste some money, here’s an app that charges you 43 dollars a month for limited functionality. But wait, there’s more. You can also pay 5 bucks per batch of headshots. Most of which will be unusable. 

The people that developed this are stealing money."
2024-11-17 17:22:09-07:00,1,Perpetual nightmare,Hoax!,"I thought I was buying all these wonderful tools. However, every time I try to use a tool, it’s another upcharge. I truly would like a refund."
2024-11-16 16:49:24-07:00,1,bold kam,Ripped off,"I purchased YouCam Perfect the beginning of 2024. I purchased the $99 lifetime deal.  Well, it doesn’t show that I even have access to what I paid for.  YouCam said to contact Apple, and Apple said to contact YouCam.  I’m sure this doesn’t happen to everyone, but it happened to me. So now I’m out $99 with no access.  If I could give this a zero star, I would.  Buyer beware!"
2024-11-11 22:38:46-07:00,1,1Maura1,Misleading advert,"I got the app because the advert I saw said there was a free version. Not a perfect version, but free.
Went through all the basic setup for account and got hut with a pay wall instead. Not cool when you advertise a free option."
2024-11-10 10:41:02-07:00,5,Linda@56,Love this app,I have been using this app for yars now and just love it.
2024-11-08 08:57:58-07:00,5,mi fabirito,G,Es perfecta ♥️♥️♥️♥️
2024-11-08 08:48:20-07:00,5,MadnessC,Love this app,I tried the free trial just to test it. Talk about awesome. My mom needed some photos edited to get my now ex step dad out of them and wow it worked so freaking good I am so impressed! Will definitely have to buy the subscription!
2024-11-08 05:59:53-07:00,5,ABaeza90,Good to work with,Easy to work with and a fun app to use
2024-11-06 14:31:23-07:00,1,PredakingXHunter,Style Transfer?,What happened to the AI style transfer?
2024-11-04 19:50:10-07:00,5,didsgg,El mejor editor,Excelente herramienta
2024-10-28 07:32:36-07:00,1,USA-DK,Garbage app,"Absolutely garbage, there are far better and free apps out there"
2024-10-22 14:07:43-07:00,1,Pogmaster300,Not really “unlimited”,Ten dollars a month and you cap the usage per day? Unlimited means unlimited. Why would I pay a subscription to still be forced into a daily limit cap? That’s false advertisting.
2024-10-22 09:46:40-07:00,1,Quinnee71,New version too much noise,I have replaced this app with Picsart. Picsart is so much better!!!  The developers have gotten greedy with this app. They put all of their other apps on this app for you to upgrade. Everything flashing all over the app. Too much noise. I don’t want 25 apps to do what one can.  I want to create. Not have greedy developers flash a bunch of apps on the one i bought. When this app expires I will be glad to get rid of it. I used to do so much with this app. now I barely use it at all.
2024-10-21 16:49:56-07:00,1,__creepin_it_real__,So frustrating.,"Update: I literally did all of the things suggested. And was never responded to. I reached out on 3 separate occasions to your support and you never responded. I finally just got my money back from Apple support. 

I’ve made three separate attempts to contact support that have gone unanswered so maybe this will get some attention. I accidentally made a purchase of a yearly subscription, I didn’t want it and tried to cancel immediately but the charge went through. It was my fault, so I wasn’t going to fight it. But now when I attempt to use the app it keeps telling me that I have no iTunes purchases in my store. It specifically states in my subscriptions on my iPhone that I have a valid subscription until October of next year. I want my money back or my app to work, I refuse to just throw $30 away."
2024-10-20 22:43:48-07:00,1,Salvia_v23,Waste of time,"It asks for your information, then asks for money, the tool is garbage. After spending 20 minutes of editing a photo, it reseted and lost all my edits"
2024-10-18 20:44:22-07:00,1,kkka8881,"Scam poorly made, canceled immediately can’t get a refund",This app is a scam to not download it. I started a free trial and deleted the app once I started using it due to how poorly made it is and turns out it didn’t cancel my subscription and now I’m stuck with paying one year fee for this app. I will never even touch. There’s 1 million better option out there for free
2024-10-16 00:52:34-07:00,1,Fhdkekcke,"Wrongfully charged, declined refund","I did not want the subscription, only the free trial, because I do not have $43 for a photo editing app. I do not want this app, I will never use it. Why can I not get refunded almost $50 for something I will literally never use, I don’t even have any social media. I am really disappointed with the lack of sympathy on support’s end."
2024-10-13 19:00:10-07:00,5,Devi-R,Awesome,Few days ago I started to use this app trying out its features and I must say it is an amazing experience so far.
2024-10-13 13:42:00-07:00,1,Edie🐶🐶🐶 dog lover,WORST APP IN THE WORLD,IT'S SOOOOO BAD YOU HAVE TO PAY FOR EVERYTHING!!!!!
2024-10-12 18:15:23-07:00,5,El 7 pastilla,Perfecta,Perfecta
2024-10-10 00:55:59-07:00,1,Cash Tapper,Headshot generator fail,I paid for the headshot generator it made all my AI suit photos with a white person's body in all 20 photos and I'm black. I would like a refund
2024-10-08 13:05:18-07:00,5,Meggtgraphy,I YouCam Perfect🥰,"I truly love this app. I use it on almost every photo. Youcam perfect is my number one go to! I love being able to remove unwanted objects, including a double chins. Youcam perfect app enhances every photo. Especially enjoy being able to whiten teeth. How awesome is that!!! Five Stars for this app."
2024-10-07 16:00:25-07:00,2,Londyn J.,Why do we have to pay!,"I love this app, but I hate that we have to buy AI pictures or pay for they templates."
2024-10-05 04:30:43-07:00,1,amber2020202020020202,fix this or i will cancel,"why did i pay for premium if i can only create 50 images a day? and then i went to bed, woke up today as it told me to come back tomorrow and it still won’t let me. this is absolutely ridiculous and you need to fix it"
2024-10-04 12:40:32-07:00,2,Just Me 💯,Dissatisfied,"I used to really love this app and didn’t mind paying for premium when I had the extra cash, but now I will be deleting it because now you pretty much have to pay for features that were originally free.  Vey disappointing now because they are making it more complicated and more expensive. Too bad because it was a great app when I first downloaded."
2024-09-30 17:25:29-07:00,5,CamiFonteles,INCRÍVEL,O melhor app de edição de foto que ja usei! ✨✨✨✨
2024-09-28 17:34:04-07:00,5,demandpoppy,Awesome Touch Up App,I’ve been using this app for years now… don’t need anything else! Worth the cheap amount of money!! Love this app (not getting paid for this hahaha)
2024-09-26 12:55:16-07:00,5,ford14925,Amazing,Love this app. Great job guys 👍
2024-09-23 18:14:56-07:00,1,Green Bay 734,WARNING ⚠️ READ BEFORE DOWNLOADING,"THIS APP IS VERY DISAPPOINTING!!! I didn’t pay for subscriptions as I am not going to waste the money, and i will tell you right now, you can’t barely do ANYTHING without a subscription. I am VERY DISAPPOINTED and VERY DISGUSTED!! I had this app for roughly 3-4 months and just recently said it was going to update, well it didn’t, all it did was turn a dark gray color and wouldn’t let me back in the app. Since I did delete the app. I’m very disappointed, do NOT recommend this app and unless you want to waste your money, I would find a different game."
2024-09-23 13:17:59-07:00,1,GinnyG86,Doesn’t work well for a paid app,"I tried the premium version. It mostly has auto AI editing, but it’s bad at detecting facial features and does a poor job of correcting basic imperfections. I definitely wouldn’t pay for this, especially since there are much better apps that offer a lot more free features that work better."
2024-09-22 11:21:40-07:00,1,audietrophie,Limited to Premium users,"I was trying to do some editing for some work and a message pops up saying “Slow down, you’ve exhausted your amount of usage for premium (50)” and I’m sitting here saying wth? It should matter how many times I use the service if I’m PAYING for it. Definitely thinking about unsubscribing. I’m not going to pay for something and being told I need to wait 24 hours to use a service that I paid for"
2024-09-17 14:17:29-07:00,1,jnrockskk,Photos don’t download and refund was refused,I truly feel like this is a scam. The photos never uploaded and I was prompted to try again “for free” but was directed to repurchase every time. Refund was refused by Apple. Do not use this app.
2024-09-16 17:50:08-07:00,1,Zylok,Can’t edit out basic things,Really good but limited even with paid version. Also changed what they can do. Ai replace keeps telling me the image would be inappropriate when all I’m trying to do is remove extra fingers from my ai photos. Needs to go back to how it was earlier this year
2024-09-15 21:18:02-07:00,5,EtBluesky,Awesome app!,"Love it, especially the AI removal feature!"
2024-09-15 15:53:12-07:00,1,Txbeachnurse,Ripoff,"Subscribed to VIP and initially loved this app. Recently repeatedly keep getting error messages in AI Replace about images resulting in inappropriate or sensitive content, now resulting in a constant new image limit message. Deleting this app and my subscription. Not worth it anymore."
2024-09-15 12:44:04-07:00,5,"DKZ Consulting, LLC",Excellent work,Nice and easy
2024-09-13 09:47:22-07:00,5,ameadams,Thank you,I love it!! The only thing I want improvement is Ai replacement should be unlimited they don’t let me use it unlimited . They give you only just 50 times a day to use
2024-09-08 10:07:16-07:00,1,AbeH2,Keeps telling me no connection,Nothing works- just spinning -
2024-08-30 08:11:24-07:00,5,🙌🏼👏🏻😍,Maravilloso App le doy mil estrellas,Maravilloso App le doy mil estrellas
2024-08-27 15:04:13-07:00,5,Momo num num,Awesome,"This app is great .If you love taking photos you’ll love this app I have no regrets. 

But there are some app purchases that make it harder to make your photos perfectly perfect"
2024-08-26 23:49:41-07:00,1,idcurappsuccs,Horrible,You have to pay to simply see the results of your editing. So weird..
2024-08-26 10:11:48-07:00,1,Britton55,Creepy,Really creepy when I write a picture to remove someone a person I don’t even know shows up on my photo
2024-08-25 12:22:42-07:00,5,El aplicación es el mejor,el mejor app,el mejor app
2024-08-24 01:14:10-07:00,1,Ih979,Just make it free!!!,Why isn’t there an option to get it free with dumb ads? I don’t need another freakin SUBSCRIPTION. I already have like 20!!! OMG I hate subscriptions. Just let me use things…. Watch a couple annoying ads so you can get your money from them….. and I’ll be on my merry way!!!! Win - win……. Ugh!!!!!
2024-08-17 11:38:35-07:00,1,RizwanAzam,Useless App,I gave it another chance but No still useless.
2024-08-17 09:07:33-07:00,1,Ladyobx,No Thank You,Seriously? Now you guys want more money so you say teeth whitening is a “premium” feature & you want  three something more a moth for that & other stuff that used to be included with the subscription? Thats a rip off & you know it. $40.00 a year is definitely a rip off for your so called premium features.
2024-08-16 08:21:38-07:00,1,NMTOH,App often freeze,Recent now app often has frozen screen unsuccessful save although memory storage free a few hundreds GB. Last 2 years app is excellent. Now a lot trouble issued
2024-08-11 19:43:02-07:00,3,HamwiseKimchi,Bring back the face contrast feature,Don’t make this app be one you have to pay for everything just like the other perfect apps.
2024-08-11 12:20:40-07:00,5,hep1008,Best,I’m using this. Very best. Thank you
2024-08-07 08:57:24-07:00,1,ificivigvi,No thanks,"Stupid now cause you have to pay for everything, waste of time"
